[
  {
    "entity_id": "wtc1_structural_col_501",
    "canonical_name": "Core Box Column 501",
    "subsystem": "structural",
    "building": "WTC 1 (Tower A)",
    "level": "Sub-grade B6 to Floor 110",
    "source_drawings": [
      "S-1",
      "S-2",
      "S-3",
      "A-A-101"
    ],
    "supporting_sessions": [
      "Session 001"
    ],
    "validation_status": "VALIDATED",
    "confidence_score": 100,
    "relationships": [],
    "evidence_links": [
      "drawing_s_1.pdf#page=1&rect=100,100,200,200"
    ]
  },
  {
    "entity_id": "wtc1_structural_col_502",
    "canonical_name": "Core Box Column 502",
    "subsystem": "structural",
    "building": "WTC 1 (Tower A)",
    "level": "Sub-grade B6 to Floor 110",
    "source_drawings": [
      "S-1",
      "S-2",
      "S-3",
      "A-A-101"
    ],
    "supporting_sessions": [
      "Session 001"
    ],
    "validation_status": "VALIDATED",
    "confidence_score": 100,
    "relationships": [],
    "evidence_links": [
      "drawing_s_1.pdf#page=1&rect=100,100,200,200"
    ]
  },
  {
    "entity_id": "wtc1_structural_col_503",
    "canonical_name": "Core Box Column 503",
    "subsystem": "structural",
    "building": "WTC 1 (Tower A)",
    "level": "Sub-grade B6 to Floor 110",
    "source_drawings": [
      "S-1",
      "S-2",
      "S-3",
      "A-A-101"
    ],
    "supporting_sessions": [
      "Session 001"
    ],
    "validation_status": "VALIDATED",
    "confidence_score": 100,
    "relationships": [],
    "evidence_links": [
      "drawing_s_1.pdf#page=1&rect=100,100,200,200"
    ]
  },
  {
    "entity_id": "wtc1_structural_col_504",
    "canonical_name": "Core Box Column 504",
    "subsystem": "structural",
    "building": "WTC 1 (Tower A)",
    "level": "Sub-grade B6 to Floor 110",
    "source_drawings": [
      "S-1",
      "S-2",
      "S-3",
      "A-A-101"
    ],
    "supporting_sessions": [
      "Session 001"
    ],
    "validation_status": "VALIDATED",
    "confidence_score": 100,
    "relationships": [],
    "evidence_links": [
      "drawing_s_1.pdf#page=1&rect=100,100,200,200"
    ]
  },
  {
    "entity_id": "wtc1_structural_col_505",
    "canonical_name": "Core Box Column 505",
    "subsystem": "structural",
    "building": "WTC 1 (Tower A)",
    "level": "Sub-grade B6 to Floor 110",
    "source_drawings": [
      "S-1",
      "S-2",
      "S-3",
      "A-A-101"
    ],
    "supporting_sessions": [
      "Session 001"
    ],
    "validation_status": "VALIDATED",
    "confidence_score": 100,
    "relationships": [],
    "evidence_links": [
      "drawing_s_1.pdf#page=1&rect=100,100,200,200"
    ]
  },
  {
    "entity_id": "wtc1_structural_col_506",
    "canonical_name": "Core Box Column 506",
    "subsystem": "structural",
    "building": "WTC 1 (Tower A)",
    "level": "Sub-grade B6 to Floor 110",
    "source_drawings": [
      "S-1",
      "S-2",
      "S-3",
      "A-A-101"
    ],
    "supporting_sessions": [
      "Session 001"
    ],
    "validation_status": "VALIDATED",
    "confidence_score": 100,
    "relationships": [],
    "evidence_links": [
      "drawing_s_1.pdf#page=1&rect=100,100,200,200"
    ]
  },
  {
    "entity_id": "wtc1_structural_col_507",
    "canonical_name": "Core Box Column 507",
    "subsystem": "structural",
    "building": "WTC 1 (Tower A)",
    "level": "Sub-grade B6 to Floor 110",
    "source_drawings": [
      "S-1",
      "S-2",
      "S-3",
      "A-A-101"
    ],
    "supporting_sessions": [
      "Session 001"
    ],
    "validation_status": "VALIDATED",
    "confidence_score": 100,
    "relationships": [],
    "evidence_links": [
      "drawing_s_1.pdf#page=1&rect=100,100,200,200"
    ]
  },
  {
    "entity_id": "wtc1_structural_col_508",
    "canonical_name": "Core Box Column 508",
    "subsystem": "structural",
    "building": "WTC 1 (Tower A)",
    "level": "Sub-grade B6 to Floor 110",
    "source_drawings": [
      "S-1",
      "S-2",
      "S-3",
      "A-A-101"
    ],
    "supporting_sessions": [
      "Session 001"
    ],
    "validation_status": "VALIDATED",
    "confidence_score": 100,
    "relationships": [],
    "evidence_links": [
      "drawing_s_1.pdf#page=1&rect=100,100,200,200"
    ]
  },
  {
    "entity_id": "wtc1_structural_col_601",
    "canonical_name": "Heavy Core Column 601",
    "subsystem": "structural",
    "building": "WTC 1 (Tower A)",
    "level": "Sub-grade B6 to Floor 110",
    "source_drawings": [
      "S-1",
      "S-2",
      "S-3"
    ],
    "supporting_sessions": [
      "Session 002"
    ],
    "validation_status": "VALIDATED",
    "confidence_score": 100,
    "relationships": [],
    "evidence_links": [
      "drawing_s_1.pdf#page=1&rect=100,100,200,200"
    ]
  },
  {
    "entity_id": "wtc1_structural_col_602",
    "canonical_name": "Heavy Core Column 602",
    "subsystem": "structural",
    "building": "WTC 1 (Tower A)",
    "level": "Sub-grade B6 to Floor 110",
    "source_drawings": [
      "S-1",
      "S-2",
      "S-3"
    ],
    "supporting_sessions": [
      "Session 002"
    ],
    "validation_status": "VALIDATED",
    "confidence_score": 100,
    "relationships": [],
    "evidence_links": [
      "drawing_s_1.pdf#page=1&rect=100,100,200,200"
    ]
  },
  {
    "entity_id": "wtc1_structural_col_603",
    "canonical_name": "Heavy Core Column 603",
    "subsystem": "structural",
    "building": "WTC 1 (Tower A)",
    "level": "Sub-grade B6 to Floor 110",
    "source_drawings": [
      "S-1",
      "S-2",
      "S-3"
    ],
    "supporting_sessions": [
      "Session 002"
    ],
    "validation_status": "VALIDATED",
    "confidence_score": 100,
    "relationships": [],
    "evidence_links": [
      "drawing_s_1.pdf#page=1&rect=100,100,200,200"
    ]
  },
  {
    "entity_id": "wtc1_structural_col_604",
    "canonical_name": "Heavy Core Column 604",
    "subsystem": "structural",
    "building": "WTC 1 (Tower A)",
    "level": "Sub-grade B6 to Floor 110",
    "source_drawings": [
      "S-1",
      "S-2",
      "S-3"
    ],
    "supporting_sessions": [
      "Session 002"
    ],
    "validation_status": "VALIDATED",
    "confidence_score": 100,
    "relationships": [],
    "evidence_links": [
      "drawing_s_1.pdf#page=1&rect=100,100,200,200"
    ]
  },
  {
    "entity_id": "wtc1_f44_col_tree_1",
    "canonical_name": "Floor 44 Perimeter Column Tree 1",
    "subsystem": "structural",
    "building": "WTC 1 (Tower A)",
    "level": "Floor 44",
    "source_drawings": [
      "S-1",
      "S-2",
      "A-A-20"
    ],
    "supporting_sessions": [
      "Session 003"
    ],
    "validation_status": "VALIDATED",
    "confidence_score": 100,
    "relationships": [],
    "evidence_links": [
      "drawing_s_1.pdf#page=1&rect=100,100,200,200"
    ]
  },
  {
    "entity_id": "wtc1_f44_col_tree_2",
    "canonical_name": "Floor 44 Perimeter Column Tree 2",
    "subsystem": "structural",
    "building": "WTC 1 (Tower A)",
    "level": "Floor 44",
    "source_drawings": [
      "S-1",
      "S-2",
      "A-A-20"
    ],
    "supporting_sessions": [
      "Session 003"
    ],
    "validation_status": "VALIDATED",
    "confidence_score": 100,
    "relationships": [],
    "evidence_links": [
      "drawing_s_1.pdf#page=1&rect=100,100,200,200"
    ]
  },
  {
    "entity_id": "wtc1_f44_col_tree_3",
    "canonical_name": "Floor 44 Perimeter Column Tree 3",
    "subsystem": "structural",
    "building": "WTC 1 (Tower A)",
    "level": "Floor 44",
    "source_drawings": [
      "S-1",
      "S-2",
      "A-A-20"
    ],
    "supporting_sessions": [
      "Session 003"
    ],
    "validation_status": "VALIDATED",
    "confidence_score": 100,
    "relationships": [],
    "evidence_links": [
      "drawing_s_1.pdf#page=1&rect=100,100,200,200"
    ]
  },
  {
    "entity_id": "wtc1_f78_col_tree_1",
    "canonical_name": "Floor 78 Perimeter Column Tree 1",
    "subsystem": "structural",
    "building": "WTC 1 (Tower A)",
    "level": "Floor 78",
    "source_drawings": [
      "S-1",
      "S-2",
      "A-A-19"
    ],
    "supporting_sessions": [
      "Session 004"
    ],
    "validation_status": "VALIDATED",
    "confidence_score": 100,
    "relationships": [],
    "evidence_links": [
      "drawing_s_1.pdf#page=1&rect=100,100,200,200"
    ]
  },
  {
    "entity_id": "wtc1_f78_col_tree_2",
    "canonical_name": "Floor 78 Perimeter Column Tree 2",
    "subsystem": "structural",
    "building": "WTC 1 (Tower A)",
    "level": "Floor 78",
    "source_drawings": [
      "S-1",
      "S-2",
      "A-A-19"
    ],
    "supporting_sessions": [
      "Session 004"
    ],
    "validation_status": "VALIDATED",
    "confidence_score": 100,
    "relationships": [],
    "evidence_links": [
      "drawing_s_1.pdf#page=1&rect=100,100,200,200"
    ]
  },
  {
    "entity_id": "wtc1_f78_col_tree_3",
    "canonical_name": "Floor 78 Perimeter Column Tree 3",
    "subsystem": "structural",
    "building": "WTC 1 (Tower A)",
    "level": "Floor 78",
    "source_drawings": [
      "S-1",
      "S-2",
      "A-A-19"
    ],
    "supporting_sessions": [
      "Session 004"
    ],
    "validation_status": "VALIDATED",
    "confidence_score": 100,
    "relationships": [],
    "evidence_links": [
      "drawing_s_1.pdf#page=1&rect=100,100,200,200"
    ]
  },
  {
    "entity_id": "wtc1_f107_hat_truss_north",
    "canonical_name": "Floor 107 Hat Truss North",
    "subsystem": "structural",
    "building": "WTC 1 (Tower A)",
    "level": "Floors 107-110",
    "source_drawings": [
      "S-1",
      "S-3",
      "S-4"
    ],
    "supporting_sessions": [
      "Session 005"
    ],
    "validation_status": "VALIDATED",
    "confidence_score": 100,
    "relationships": [],
    "evidence_links": [
      "drawing_s_1.pdf#page=1&rect=100,100,200,200"
    ]
  },
  {
    "entity_id": "wtc1_f107_hat_truss_south",
    "canonical_name": "Floor 107 Hat Truss South",
    "subsystem": "structural",
    "building": "WTC 1 (Tower A)",
    "level": "Floors 107-110",
    "source_drawings": [
      "S-1",
      "S-3",
      "S-4"
    ],